article,category
"AdvertisementSupported byThe Library of Congress on Wednesday announced its 25 annual additions to the National Recording Registry, honoring significant pieces of American history and culture. While some of the titles are instantly recognizable — the “Sound of Music” soundtrack, the Temptations’ “My Girl” and Fleetwood Mac’s “Rumours” album — others are more significant for their influence on future generations.“Sitting on Top of the World” was recorded in 1930 by the Mississippi Sheiks. The malleable song would be performed in various styles, from folk to country to bluegrass: Cream, Howlin’ Wolf, Willie Nelson, Bob Dylan and Jack White all have versions.The National Recording Registry now has 500 titles. Others added this year include Bill Haley & His Comets’ “Rock Around the Clock,” Tony Bennett’s “I Left My Heart in San Francisco,” Gloria Estefan’s “Rhythm Is Gonna Get You,” Run-DMC’s “Raising Hell” album and Canario y Su Grupo’s “Lamento Borincano,” about the plight of a Puerto Rican farmer.AdvertisementCollapseSEE MY OPTIONS",Music
"AdvertisementSupported byCapping the celebration of its 100th anniversary, the San Francisco Conservatory of Music on Wednesday announced a gift of $46.4 million from the William K. Bowes, Jr. Foundation, among the largest donations ever to an American music school.The gift will help fund construction of a $185 million, 12-story building on a site just south of San Francisco City Hall. Designed by Mark Cavagnero Associates and scheduled to open in 2020, it will include two concert halls, rehearsal spaces, high-tech studios and classrooms, and will provide housing for the student body.“It will shape the future of the conservatory, in one of the most exciting pieces of real estate in the world,” David H. Stull, the school’s president, said in a phone interview.Founded in 1917 by Ada Clement and Lillian Hodghead, the San Francisco Conservatory is the oldest independent music school on the West Coast, with luminaries like Yehudi Menuhin and Isaac Stern among the alumni of its youth program. While the school has long emphasized risk-taking and an expansive view of the field, Mr. Stull has pushed it and its curriculum toward the future since becoming president in 2013. Its program in Technology and Applied Composition (TAC), which began offering courses in 2015, has been forging a new identity for the 21st-century composer.Though both composition and technology are fields dominated by men, the TAC program has managed the rare achievement of gender parity, with 13 women and 12 men in its most recently completed cohort. (The conservatory’s traditional composition program had five women and 24 men in the same cohort.)Driving the program’s development has been its executive director, MaryClare Brzytwa, a composer and educator who combines classical training as a flutist with a background in computer music. She led efforts to recruit as visiting faculty women at the top of their fields in tech-related musical careers. Teachers such as the Grammy-winning Leslie Ann Jones (who directs music recording and scoring at Skywalker Sound) and Jaclyn Shumate (an audio director at Microsoft), Ms. Brzytwa said, “allow my students to see it as normal for women to have these careers.”TAC complements training in composition with special courses in software and studio technology to equip students for careers in such fields as film scoring and video game sound design, as well as in production. The new building, to be named the Ute and William K. Bowes, Jr. Center for Performing Arts, will house a special “technology hall” with a state-of-the-art recording studio and other equipment focused on TAC.“Our students learn how to write classical music and real-world production skills at the same time,” Ms. Brzytwa said. “Stylistically, they come from many perspectives — jazz, classical or electronic music — and there is a lot of leeway to plan a path of their own. But all of them seem to want rigor.”Even students who are not pursuing composition in the TAC program recognize its influence on the school’s direction. DuMarkus Davis, who is in his second year as a violin student, says he decided to move from his native Atlanta to San Francisco “because I wanted to do something involving musical entrepreneurship and wanted to be surrounded by the tech in Silicon Valley. I knew that the TAC program was an element of SFCM. All of that ultimately sold me on the conservatory.”Before coming to the school for TAC’s one-year professional studies program, Emily Pitts had earned a degree in software engineering at the Massachusetts Institute of Technology and then spent five years in the corporate world, pursuing a passion for writing music for film and video games on the side. Even before graduating, she has been hired at Facebook to work with its 360 Spatial Workstation team to design spatial audio for its video player.“It’s a marriage between my engineering and audio interests,” Ms. Pitts said.“In the real world, it can feel intimidating, like you’re trying to get into this boys’ club,” she added. “Working with so many other women and seeing your peers succeed and excel has been great.”AdvertisementCollapseSEE MY OPTIONS",Music
"AdvertisementSupported bythat decisive momentAt 7 minutes 23 secondsToday, there’s likely no better way to experience a live performance of Duke Ellington’s extended work “Black, Brown and Beige” than in a concert by the Jazz at Lincoln Center Orchestra. The trumpeter and composer Wynton Marsalis’s group delivered a dazzling account of the nearly hourlong piece on Saturday. The themes of the first movement, “Black,” were profoundly shaped and brought into rich dialogue; the “West Indian Dance” section of the second movement offered galvanizing swing. And the vocalist Brianna Thomas provided a powerful rendition of the “Blues” section (also part of “Brown”).Afterward, I revisited a collaboration between this orchestra and the New York Philharmonic, only recently released: a performance of an orchestral version of Ellington’s “A Tone Parallel to Harlem,” recorded at a Philharmonic concert in 1999. As conducted by Kurt Masur, this version of an Ellington touchstone differs in subtly rewarding ways from a 1970 recording made by the Duke himself with the Cincinnati Symphony Orchestra (and on which string arrangements were likely provided by Luther Henderson).Read our review of the recital.Read our profile of Ms. Yende.Read about “Tristan” in Cleveland.AdvertisementCollapseSEE MY OPTIONS",Music
"AdvertisementSupported byOp-Ed ContributorMr. Hoffman is a classical violist and radio commentator.I was talking about music recently with a friend who makes his living cloning genes, manipulating molecules and investigating the pathways of the human immune system. This is a person whose intellectual molecules are clearly very well arranged. But he proceeded to tell me that although he loved classical music, when he listened to it he wasn’t able to perceive anything other than his own emotional reactions.Could it be true? Well, he thought it was. But he was wrong.What my friend was expressing was merely a symptom of a common affliction, one that crosses all intellectual, social and economic classes: the Classical Music Insecurity Complex. Immediate therapy was indicated.There’s no question, I pointed out, that he perceives more than just his own reactions. Lots more. In every piece he listens to he perceives changes, both great and small, in tempo, volume, pitch and instrumentation. He perceives melodies, harmonies and rhythms, and their patterns. He perceives, in short, virtually all the musical ingredients that composers manipulate to stimulate emotional effects, which is precisely why he’s emotionally affected. His “problem” isn’t perception — it’s description. And what he doesn’t know is the jargon, the technical terms for the ingredients and manipulations.And why should he? He’s a scientist, not a musician. And frankly, it’s not even essential that he be aware of the specific musical and technical means by which his reactions are being stimulated.Years ago I was rehearsing a piece for flute, viola and piano by the composer Seymour Barab. Mr. Barab was attending the rehearsal, and the pianist asked him at one point if it was important to “bring out,” or highlight, a certain clever rhythmic pattern. Mr. Barab’s instant reaction was to shout: “No! It’s none of your business!”It’s sad but true that many people denigrate and distrust their own reactions to classical music out of fear that they don’t “know enough,” and that other, more sophisticated folks know more. When people leave the movie theater they rarely hesitate to give their opinion of the movie, and it never occurs to them that they don’t have a right to that opinion. And yet after most classical music concerts you can swing your program around from any spot in the lobby and hit a dozen perfectly capable and intelligent people issuing apologetic disclaimers: “Boy, I really loved that — but I’m no expert” or “It sounded pretty awful to me, but I don’t really know anything, so I guess I just didn’t get it.”At least those people showed up. Many others are too intimidated to attend classical concerts at all.I’m all for knowledge — I’ve spent most of my career as a musician and commentator trying to help people learn more about music, and to remove any obstacles to the enjoyment of it. The Classical Music Insecurity Complex is a barrier of discomfort. Experience, exposure and familiarity play critical roles in helping to lower that barrier, and a little learning, along with basic explanations of technical (and foreign) terms and concepts, can be of great value.What is not of value, and is in fact completely off-putting and counterproductive, is the kind of introductory concert talk, review or program note that uses technical terms rather than plain English to explain other technical terms and to “describe” musical works. Program notes that use phrases like “the work features a truncated development with chromatic modulations to distant keys and modally inflected motivic cells,” for example, do not exactly help to break down barriers and put people at ease.Perhaps it’s overly optimistic of me, but I still cling to the hope that, with the right approaches and experiences, longtime sufferers will feel sufficiently encouraged to go ahead and jettison the C.M.I. Complex outright. I’d like the legions of actual and potential classical music lovers to believe that, like my friend the scientist, they hear more than they can name, and that the very point of listening to great music is to be moved, not to put names on what moves you.Miles Hoffman is the violist of the American Chamber Players and the classical music commentator for NPR’s “Morning Edition.”AdvertisementCollapseSEE MY OPTIONS",Music
"AdvertisementSupported byIt was rich with history, potently political and visually grand. By turns uproarious, rowdy, and lush. A gobsmacking marvel of choreography and musical direction.She does macro, too — she was joined onstage by approximately 100 dancers, singers and musicians, a stunning tableau that included fraternity pledges and drumlines and rows of female violinists in addition to the usual crackerjack backup dancers (which here included bone breakers and also dancers performing elaborate routines with cymbals).Some superstars prize effortlessness, but Beyoncé shows her work — the cameras captured the force and determination in her dancing, and also her sweat. She performed for almost two hours, with only a few breaks, and her voice rarely flagged. Occasionally her set was punctuated with fireworks that, compared with what was happening onstage, seemed dull.She was arguing not in defense of herself, but of her forebears. And her performance was as much ancestral tribute and cultural continuum — an uplifting of black womanhood — as contemporary concert. She sang “Lift Every Voice and Sing,” often referred to as the black national anthem, incorporated vocal snippets of Malcolm X and Chimamanda Ngozi Adichie, and nodded at Ms. Simone’s “Lilac Wine.”And she rendered her personal history as well. During the second half of the show, she unfurled a kind of This Is Your Life in reverse. First came her husband, Jay-Z, on “Déjà Vu” — with him, she was affectionate while easily outshining him. Then, a true surprise: a reunion with her former Destiny’s Child groupmates Kelly Rowland and Michelle Williams, during which she happily ceded the main spotlight. After that came a playful dance routine with her sister, Solange, on “Get Me Bodied.” (Sadly, there was no “Ring Off” with her mother, nor a rendition of “Daddy Lessons” with her father.)Beyoncé performs at the Coachella Valley Music and Arts Festival on April 21; coachella.com.AdvertisementCollapseSEE MY OPTIONS",Music
"AdvertisementThough she only got to see part of Chile’s Route of Parks, our columnist found plenty of joy — and solitude.The footwear designer talks about the traveling exhibition “The Art of Shoes,” where he goes for inspiration and his favorite creations.Months after Hurricane Maria, the island struggles to regain its balance. The flora tells the melancholy story.The St. Regis New York has butlers as an amenity for guests. We arrived ready with requests, from coffee to ironing to cupcakes.Its chef, the first African-American to win that prize, and Gabrielle Hamilton of Prune lead a list that is long on women and minorities.Michael Powell’s 1937 film “The Edge of the World” tells of the desertion of St. Kilda in the Outer Hebrides. Today, the islands’ beauty remains, as do signs of what once was.From Spain to Macedonia, celebrating food, flowers, seasons and traditions.Flying can be stressful, but there are ways to make it a better experience for you and your family. We’ll offer tips for getting through the airport, having a restful experience in the air and arriving refreshed and ready to hit the ground running.Baieta, with a 23-year-old chef at the helm, foregoes an Instagram-oriented atmosphere for a firm focus on what matters most: the food.Hotel Lemongarden and Brown Beach House, two boutique hotels, offer some glamour by the sea.In Alabama’s capital, you’ll find deep-fried bacon, stylish bars and revitalized neighborhoods. But the city’s real draw is its museums and other sites that focus on the evolution of civil rights.A road trip includes centuries-old churches, a welcoming winery and workshops and studios where weaving is an art.The Food Network host and cookbook author recommends pizza bianca in Rome, gelato in Florence and pasta near Naples.A starter kit for escaping into the world.The southern tip of Baja California, Mexico, turned out to be like an immersive choose-your-own-adventure novel. Here are a few of those turns, and the resulting ups and downs.I never imagined that my main takeaway from the Bolivian city, where women have struggled for equality, would be one of female empowerment — thanks to everyone from chefs to wrestlers.Richness is everywhere in the Colombian capital, from vivid street art to what may be the gaudiest restaurant you’ve ever seen.The pre-Incan ruins of Kuélap share similarities with their more famous cousin. But getting there can be a herculean effort.Peninsula Papagayo is where the ultrarich go to avoid having to interact with the regular rich. But our 52 Places columnist finds a way to get away from the traps of luxury.Forty-three years after the fall of Saigon and almost 13 years after Hurricane Katrina, many residents wonder if their long-resilient community is nearing another — quieter — inflection point.Meet brASS: a New York City troupe that is reclaiming a scene that they say has often left out women of color, queer, and transgender performers.A community has formed around Chinese opera in Thailand, preserving one of the oldest dramatic art forms in the world.A growing community of people in Nairobi are reclaiming the city’s bus culture using new practices, art and social media to combat negative stereotypes.A creative community gathers around the stage at LayeRhythm, an occasional party where random ideas turn into music and movement.Luxurious L.A. may feel like a pricey destination, but these simple tips will help you enjoy a luxury visit to the city without breaking the bank.There’s no shortage of ways to save money and really experience everything Tokyo has to offer. Here are six tips to get you started.Travelers continue to book trips to Cancún and the Riviera Maya, where homicides have prompted authorities to increase security.Traveling by bus abroad can be a fun and affordable way to see the sights, but depending on where you go, road safety can be a big issue. Here’s what to know before you go.If you’re willing to travel in the spring instead of the summer, you can enjoy some of the most luxurious Italian coast resorts for much, much less.Soogil’s chef was a sous-chef at Daniel; it shows in his love of foie gras and his soy-braised short rib.By PETE WELLSTo honor the comedian John Oliver, the actor Russell Crowe has donated a new medical ward in Australia to treat koalas with chlamydia.By ISABELLA KWAIAn otherworldly archipelago with wide sand beaches, medieval castles and a disproportionate number of world-class restaurants.By MICHAELA TRIMBLEOh, to be 18. And a citizen of the European Union.By YONETTE JOSEPHPrime Minister Jacinda Ardern stars in the latest video by a New Zealand government agency to use humor to get its message across.By CHARLOTTE GRAHAM-McLAYThe remarkable landscape, discovered only in the past five years, has become a must-see attraction. But the tourism boom may be environmentally harmful.By ILIANA MAGRA and ANDREA ZARATEBab Marrakech, a Bay Ridge restaurant owned by natives of Morocco, offers delicate couscous and expansive plates of meat.By LIGAYA MISHANThe legislation prohibits the distribution of sunscreens containing chemicals that scientists have found contributes to coral bleaching when washed off in the ocean.By ELAINE GLUSACMontgomery’s wealth of civil rights museums alone make it worth a visit, but its bars, restaurants and riverfront add to its charm and culture. Before you go, follow our guide to plan your visit, and pack these essentials for your trip.By ALAN HENRYWith the launch of Secret Fares, the app is promising discounted trips that travelers won’t be able to find anywhere else.By JUSTIN SABLICHNicaragua’s housing market has improved since the 2008 global financial crisis, but recent social unrest has put a damper on sales of late.By VIVIAN MARINOFrom England to Greece, where to stay if you’re in the mood for celebrating.By ELAINE GLUSACKlek, or squat, shops, in former basement bunkers in Bulgaria’s capital are evolving with the times, transforming into modern shops, artist studios and speakeasies.By ELIOT STEINSince an Israeli rabbi put the kibosh on Jewish-style fried artichokes, Italian Jews have mounted a fierce defense of their beloved treat.By JASON HOROWITZPim Techamuanvivit, who grew up in Thailand, has taken over from the founding chef, David Thompson.By TEJAL RAOFederal regulators and some lawmakers are looking to crack down on untrained pets being passed off as legitimate service or emotional support animals.By CHRISTOPHER MELEIf you happen to be in Yorkshire for the Kettlewell Scarecrow Festival this August, don’t be surprised if you run into a few familiar straw-stuffed figures.By MARK VANHOENACKERGlobal momentum has built in recent months to ban plastic straws and replace them with biodegradable paper ones. But cruise lines and luxury resorts are lagging.By ADAM H. GRAHAMA city known for its barbecue and Tex-Mex cooking has spawned an accomplished roster of Japanese restaurants.By BRETT ANDERSONA new travel company wants to take you to your next outdoor adventure in a tour bus packed with resort-style comforts and rock star amenities.By ELAINE GLUSACGet a curated digest of lifestyle news delivered to your inbox twice a week.Soogil’s chef was a sous-chef at Daniel; it shows in his love of foie gras and his soy-braised short rib.By PETE WELLSTo honor the comedian John Oliver, the actor Russell Crowe has donated a new medical ward in Australia to treat koalas with chlamydia.By ISABELLA KWAIAn otherworldly archipelago with wide sand beaches, medieval castles and a disproportionate number of world-class restaurants.By MICHAELA TRIMBLEOh, to be 18. And a citizen of the European Union.By YONETTE JOSEPHPrime Minister Jacinda Ardern stars in the latest video by a New Zealand government agency to use humor to get its message across.By CHARLOTTE GRAHAM-McLAYThe remarkable landscape, discovered only in the past five years, has become a must-see attraction. But the tourism boom may be environmentally harmful.By ILIANA MAGRA and ANDREA ZARATEBab Marrakech, a Bay Ridge restaurant owned by natives of Morocco, offers delicate couscous and expansive plates of meat.By LIGAYA MISHANThe legislation prohibits the distribution of sunscreens containing chemicals that scientists have found contributes to coral bleaching when washed off in the ocean.By ELAINE GLUSACMontgomery’s wealth of civil rights museums alone make it worth a visit, but its bars, restaurants and riverfront add to its charm and culture. Before you go, follow our guide to plan your visit, and pack these essentials for your trip.By ALAN HENRYWith the launch of Secret Fares, the app is promising discounted trips that travelers won’t be able to find anywhere else.By JUSTIN SABLICHNicaragua’s housing market has improved since the 2008 global financial crisis, but recent social unrest has put a damper on sales of late.By VIVIAN MARINOFrom England to Greece, where to stay if you’re in the mood for celebrating.By ELAINE GLUSACKlek, or squat, shops, in former basement bunkers in Bulgaria’s capital are evolving with the times, transforming into modern shops, artist studios and speakeasies.By ELIOT STEINSince an Israeli rabbi put the kibosh on Jewish-style fried artichokes, Italian Jews have mounted a fierce defense of their beloved treat.By JASON HOROWITZPim Techamuanvivit, who grew up in Thailand, has taken over from the founding chef, David Thompson.By TEJAL RAOFederal regulators and some lawmakers are looking to crack down on untrained pets being passed off as legitimate service or emotional support animals.By CHRISTOPHER MELEIf you happen to be in Yorkshire for the Kettlewell Scarecrow Festival this August, don’t be surprised if you run into a few familiar straw-stuffed figures.By MARK VANHOENACKERGlobal momentum has built in recent months to ban plastic straws and replace them with biodegradable paper ones. But cruise lines and luxury resorts are lagging.By ADAM H. GRAHAMA city known for its barbecue and Tex-Mex cooking has spawned an accomplished roster of Japanese restaurants.By BRETT ANDERSONA new travel company wants to take you to your next outdoor adventure in a tour bus packed with resort-style comforts and rock star amenities.By ELAINE GLUSACGo to Home Page »",Music
