article,category
"AdvertisementSupported bySportingI’ve come to think that Venmo, PayPal and the like might very well go out of business were it not for the annual three-week gambling festival known as the N.C.A.A. Division I men’s basketball tournament (estimated wagers this year: more than $10 billion).But maybe that’s just me, what with the many bracket pools I’m invited to join every spring and the associated entry fees I’m asked to payment-app-as-verb to various gambling enablers — I mean pool organizers — around the country.My particular challenges aside, this year’s iteration of March Madness and the Final Four is yet another reminder of America’s long-simmering and complex relationship with sports betting.That none of these developments has rallied much outcry or opposition reflects both an evolution and devolution of attitudes toward the subject.Credit, too, the escalation of athletes’ salaries, which makes the reward of taking bribes to throw games rarely worth the risk of getting caught. (It’s no coincidence that tennis and lower-tier soccer — whose competitors often earn little enough to be vulnerable — continue to struggle most with match fixing.)Gambling does not represent any kind of new threat to American sports. On the contrary, it’s a homecoming of sorts to sports’ roots.There’s no record of it, but it’s almost a certainty that as soon as the first pair of crook-wielding Scottish shepherds decided to see who could knock dried sheep dung closest to a rabbit hole — golf! — so, too, did a couple of nearby highland lads agree to wager on the outcome. Ancient Olympics, scholars believe, had betting scandals, involving bribetaking athletes throwing a wrestling match or foot race.More relevant and recent is the close connection between betting and two of the world’s oldest and most popular organized sports, cricket and baseball — both, it should be noted, invented in England.Betting was so integral to cricket’s modern provenance that the first rules books were concerned almost entirely with the adjudication of betting disagreements. Likewise, the earliest newspaper accounts of cricket matches focused a little on runs tallied and a lot on amounts wagered. Landed gentry and other moneyed types were especially fond of the new hobby.Baseball, one of the earliest known references to which (“base-ball”) shows up in a 1744 English publication, “A Little Pretty Pocket Book,” also began as child’s play but flowered as an adult activity. But America’s “national pastime,” which started evolving almost as soon as play began in North America, retained at least one strand of British sporting DNA: Yanks loved to gamble on it — and not just on the outcome of games.So fast were bets laid and so furiously did money change hands that serious gamblers congregated near the field, in sections referred to as “pool boxes.” Their coarse banter and unseemly behavior — imagine a stock trading pit, but with chewing tobacco and whiskey — forced many of the game’s organizers, who were interested in drawing families and other wholesome spectators, to shut down the pool boxes.This did nothing to curtail betting because the pool boxes simply reset nearby, in saloons and billiards halls, using runners to bring news back from the diamond.In fact, so closely did betting pools and pool boxes become associated with billiards that when sports-bar patrons took a break from this March’s madness, some doubtless turned away from the bank of TVs, picked up a cue stick and challenged someone to a game Americans long ago stopped referring to as billiards and started, for obvious reasons, calling pool.As for this spring’s pools, expect a frenzy of digital transactions once the 2018 tourney champ is crowned and winnings are distributed. Just don’t expect any money to wind up in my Venmo account. My brackets were busted quicker than you can say Sister Jean.Gary Belsky, the former editor in chief of ESPN The Magazine, is a co-author of “On the Origins Of Sports: The Early History and Original Rules of Everybody’s Favorite Games.”AdvertisementCollapseSEE MY OPTIONS",Sports
"AdvertisementThey had the best record in the Eastern Conference and a new approach designed for playoff success. Enter LeBron James.Linda Haywood, a Chicago retiree, traces her lineage to Johnson, the first black heavyweight champion, and strives to erase a racially charged conviction.First-place Boston arrives for a three-game clash starting Tuesday with the Yankees on an 18-3 tear.After a quiet first half, James put up another big game against the Toronto Raptors while securing the 12th playoff series sweep of his 15-year career.Luke Heimlich is among the best collegiate pitchers and may take Oregon State to the College World Series. He was also convicted of molesting his 6-year-old niece, a crime he says never happened.The former chief executive of ESPN, who resigned in December after revealing a substance abuse problem, has landed at Perform Group.Golden State has typically reserved its best lineup for the end of games, but the rest of the league is on notice: The Hamptons Five is now starting.Tiafoe has long been considered one of the greatest prospects in his generation, but he had few achievements at the tour level until recently.The former Red homered and Adrian Gonzalez went deep twice as the Mets’ struggling offense did enough to earn a win.Hafthor Julius Bjornsson took a break from playing the brutal warrior known as the Mountain and won the World’s Strongest Man competition.Washington and its star are in the Eastern Conference finals after more than a decade of coming painfully close.Major League Baseball’s first games in Europe will be June 29 and 30, 2019, at the Olympic stadium in London.European teams and fans, detached from the fraught history that Native American imagery carries in U.S. sports, have their own ideas about what is socially acceptable.The Celtics forward put on a display of the myriad ways his experience helps as he guided a roster of young players to an overtime victory in Game 3.The Blue Jays reliever will appear in court on June 18 but M.L.B.’s domestic violence policy allows discipline regardless of whether there is a trial.By THE ASSOCIATED PRESSEvgeny Kuznetsov’s overtime goal ended Pittsburgh’s hopes of a third straight Stanley Cup title.By THE ASSOCIATED PRESSA surprise starter, McConnell scored a career-high 19 points as Philadelphia beat the Boston Celtics. Boston leads the series 3-1.By THE ASSOCIATED PRESSReid, a free agent safety, says the league has blackballed him for his protests during the national anthem.By VICTOR MATHERThe Boston Bruins left wing could face discipline after licking an opponent during a game for the second time in a month.By MATT STEVENSThe Golden State Warriors rolled to an easy win over the New Orleans Pelicans and the Houston Rockets beat the Utah Jazz.By THE ASSOCIATED PRESSVegas beat San Jose to advance to the Western Conference finals in their inaugural season, and the Lightning reached the East finals for the third time in four years.By THE ASSOCIATED PRESSBarcelona salvaged a draw and remained unbeaten in league play despite playing down a man after Sergi Roberto’s red card just before halftime.By THE ASSOCIATED PRESSA strange week for the Mets ended with yet another loss, Yoenis Cespedes injured, and Jacob deGrom on the disabled list.By JAMES WAGNERTorres’s first major league homer on Friday was overshadowed by a wild ending, but his second, on Sunday, proved even more memorable.By DAVID WALDSTEINA lawsuit claims that Steven and Jean Lopez, an Olympian and his star coach, sexually assaulted girls and women for years, and that Olympic officials knew.By JACEY FORTINRather than adopt another team or renounce hockey, some Atlanta Thrashers supporters have chosen to stick with the franchise, which left for Winnipeg in 2011.By BEN SHPIGELThe Cavaliers took a 3-0 series lead against Toronto with a 105-103 overtime win on Saturday night in their second-round N.B.A. playoff series.By THE ASSOCIATED PRESSJakub Vrana scored the go-ahead goal as the Washington Capitals won, 6-3, and took a three-games-to-two lead in the second-round N.H.L. series.By THE ASSOCIATED PRESSManchester United’s former longtime manager had emergency surgery on Saturday for a brain hemorrhage, the team said in a statement.By THE ASSOCIATED PRESSNolan Arenado’s first-inning home run was all the Rockies needed on Saturday night at Citi Field.By WALLACE MATTHEWSThe Celtics took a 3-0 series lead against Philadelphia, which could not overcome two errant passes at key moments and a premature blast from a confetti cannon.By SCOTT CACCIOLAAlejandro Romero Gamarra had a goal and two assists to lead the Red Bulls on Saturday in the New York derby.Indians shortstop Francisco Lindor’s double error led to a pair of runs in a four-run fifth inning. It is the Yankees’ first 14-1 stretch since 1998.By DAVID WALDSTEINIn a steady rain, Justify, a chestnut colt who did not race as a 2-year-old, won the 144th Kentucky Derby. Good Magic was second, followed by Audible.By MELISSA HOPPERTHe has covered Jordan. He's covered Kobe. And LeBron vs. the Warriors. Go behind the N.B.A.'s curtain with the league's foremost expert in a new basketball newsletter.Get the big sports news, highlights and analysis from Times journalists, with distinctive takes on games and some behind-the-scenes surprises, delivered to your inbox every week.The Blue Jays reliever will appear in court on June 18 but M.L.B.’s domestic violence policy allows discipline regardless of whether there is a trial.By THE ASSOCIATED PRESSEvgeny Kuznetsov’s overtime goal ended Pittsburgh’s hopes of a third straight Stanley Cup title.By THE ASSOCIATED PRESSA surprise starter, McConnell scored a career-high 19 points as Philadelphia beat the Boston Celtics. Boston leads the series 3-1.By THE ASSOCIATED PRESSReid, a free agent safety, says the league has blackballed him for his protests during the national anthem.By VICTOR MATHERThe Boston Bruins left wing could face discipline after licking an opponent during a game for the second time in a month.By MATT STEVENSThe Golden State Warriors rolled to an easy win over the New Orleans Pelicans and the Houston Rockets beat the Utah Jazz.By THE ASSOCIATED PRESSVegas beat San Jose to advance to the Western Conference finals in their inaugural season, and the Lightning reached the East finals for the third time in four years.By THE ASSOCIATED PRESSBarcelona salvaged a draw and remained unbeaten in league play despite playing down a man after Sergi Roberto’s red card just before halftime.By THE ASSOCIATED PRESSA strange week for the Mets ended with yet another loss, Yoenis Cespedes injured, and Jacob deGrom on the disabled list.By JAMES WAGNERTorres’s first major league homer on Friday was overshadowed by a wild ending, but his second, on Sunday, proved even more memorable.By DAVID WALDSTEINA lawsuit claims that Steven and Jean Lopez, an Olympian and his star coach, sexually assaulted girls and women for years, and that Olympic officials knew.By JACEY FORTINRather than adopt another team or renounce hockey, some Atlanta Thrashers supporters have chosen to stick with the franchise, which left for Winnipeg in 2011.By BEN SHPIGELThe Cavaliers took a 3-0 series lead against Toronto with a 105-103 overtime win on Saturday night in their second-round N.B.A. playoff series.By THE ASSOCIATED PRESSJakub Vrana scored the go-ahead goal as the Washington Capitals won, 6-3, and took a three-games-to-two lead in the second-round N.H.L. series.By THE ASSOCIATED PRESSManchester United’s former longtime manager had emergency surgery on Saturday for a brain hemorrhage, the team said in a statement.By THE ASSOCIATED PRESSNolan Arenado’s first-inning home run was all the Rockies needed on Saturday night at Citi Field.By WALLACE MATTHEWSThe Celtics took a 3-0 series lead against Philadelphia, which could not overcome two errant passes at key moments and a premature blast from a confetti cannon.By SCOTT CACCIOLAAlejandro Romero Gamarra had a goal and two assists to lead the Red Bulls on Saturday in the New York derby.Indians shortstop Francisco Lindor’s double error led to a pair of runs in a four-run fifth inning. It is the Yankees’ first 14-1 stretch since 1998.By DAVID WALDSTEINIn a steady rain, Justify, a chestnut colt who did not race as a 2-year-old, won the 144th Kentucky Derby. Good Magic was second, followed by Audible.By MELISSA HOPPERTGo to Home Page »",Sports
"AdvertisementSupported byQ. & A.When did you first get the idea to write this book?It’s long been a curiosity of mine, why people were so intense about their favorite team. I certainly had my favorites throughout my life. As a young person, it was Notre Dame football; and growing up in California, the Giants in baseball and the Warriors in basketball. Most of those teams fell away, but what became my one true obsession was the United States men’s national soccer team.Then I had kids — I have an eight-year-old and a five-year-old — and started asking myself about fandom and how to introduce it to them. It all came together three or four years ago. It felt like the moment, professionally and personally, for me to dive into this book. There are so many books that explore someone’s individual fandom, but those aren’t that accessible. If I’m not a Red Sox fan, I’m not going to read a book about a Red Sox fan. I thought, if you wrote something that introduced different people from around the country, that was a more approachable way to analyze fandom.What’s the most surprising thing you learned while writing it?I talked to Susan Harter, a renowned child psychologist, about how kids receive their parents’ fandom. She told me that we shouldn’t be introducing our kids to fandom until adolescence. This runs contrary to what we do. We put a baby in a Green Bay Packers onesie. This is what we see all the time, and we celebrate it, posting pictures of it and saying how cute it is. But a kid I wrote about, an Eagles fan, was just melting down in YouTube videos while the Patriots were beating his team.Harter said kids want to see the world in black and white. They want to divide the world into good and bad. And sports does that. But the kids don’t understand that the fact that their teacher is an Auburn fan doesn’t make them a bad person. They don’t understand that daddy’s going to be O.K. when his team loses. They lack perspective. They can’t say, “Well, it’s been a good season even though we lost this game.”Sometimes now I watch a game outside the home so my kids don’t see me yelling at the TV and see that it’s important to me. I don’t want them to make it important right now.In what way is the book you wrote different from the book you set out to write?Initially I wanted to have more fan-athlete engagement in the book, more opportunities for athletes to confront the fans who often say critical things about them. I thought that would make for good reading. And I did reach out to some athletes, but ultimately I concluded that part of fandom — “blazing” is what they call it, that troll behavior — while it exists, it felt like falling into a trap, just looking at the worst of fans. There is some bad behavior in the book, but it felt too voyeuristic to keep highlighting these really extreme negative fans.Who is a creative person (not a writer) who has influenced you and your work?Persuade someone to read “Superfans” in 50 words or less.A lot of people wonder about sports fans’ behavior. They might be husbands, wives, brothers, sisters, roommates, girlfriends, boyfriends. These people ask: “Why are they like that?” This book will open your eyes so wide to that behavior, and you’ll be able to tick off the reasons.This interview has been condensed and edited.AdvertisementCollapseSEE MY OPTIONS",Sports
"AdvertisementThey had the best record in the Eastern Conference and a new approach designed for playoff success. Enter LeBron James.Linda Haywood, a Chicago retiree, traces her lineage to Johnson, the first black heavyweight champion, and strives to erase a racially charged conviction.First-place Boston arrives for a three-game clash starting Tuesday with the Yankees on an 18-3 tear.After a quiet first half, James put up another big game against the Toronto Raptors while securing the 12th playoff series sweep of his 15-year career.Luke Heimlich is among the best collegiate pitchers and may take Oregon State to the College World Series. He was also convicted of molesting his 6-year-old niece, a crime he says never happened.The former chief executive of ESPN, who resigned in December after revealing a substance abuse problem, has landed at Perform Group.Golden State has typically reserved its best lineup for the end of games, but the rest of the league is on notice: The Hamptons Five is now starting.Tiafoe has long been considered one of the greatest prospects in his generation, but he had few achievements at the tour level until recently.The former Red homered and Adrian Gonzalez went deep twice as the Mets’ struggling offense did enough to earn a win.Hafthor Julius Bjornsson took a break from playing the brutal warrior known as the Mountain and won the World’s Strongest Man competition.Washington and its star are in the Eastern Conference finals after more than a decade of coming painfully close.Major League Baseball’s first games in Europe will be June 29 and 30, 2019, at the Olympic stadium in London.European teams and fans, detached from the fraught history that Native American imagery carries in U.S. sports, have their own ideas about what is socially acceptable.The Celtics forward put on a display of the myriad ways his experience helps as he guided a roster of young players to an overtime victory in Game 3.The Blue Jays reliever will appear in court on June 18 but M.L.B.’s domestic violence policy allows discipline regardless of whether there is a trial.By THE ASSOCIATED PRESSEvgeny Kuznetsov’s overtime goal ended Pittsburgh’s hopes of a third straight Stanley Cup title.By THE ASSOCIATED PRESSA surprise starter, McConnell scored a career-high 19 points as Philadelphia beat the Boston Celtics. Boston leads the series 3-1.By THE ASSOCIATED PRESSReid, a free agent safety, says the league has blackballed him for his protests during the national anthem.By VICTOR MATHERThe Boston Bruins left wing could face discipline after licking an opponent during a game for the second time in a month.By MATT STEVENSThe Golden State Warriors rolled to an easy win over the New Orleans Pelicans and the Houston Rockets beat the Utah Jazz.By THE ASSOCIATED PRESSVegas beat San Jose to advance to the Western Conference finals in their inaugural season, and the Lightning reached the East finals for the third time in four years.By THE ASSOCIATED PRESSBarcelona salvaged a draw and remained unbeaten in league play despite playing down a man after Sergi Roberto’s red card just before halftime.By THE ASSOCIATED PRESSA strange week for the Mets ended with yet another loss, Yoenis Cespedes injured, and Jacob deGrom on the disabled list.By JAMES WAGNERTorres’s first major league homer on Friday was overshadowed by a wild ending, but his second, on Sunday, proved even more memorable.By DAVID WALDSTEINA lawsuit claims that Steven and Jean Lopez, an Olympian and his star coach, sexually assaulted girls and women for years, and that Olympic officials knew.By JACEY FORTINRather than adopt another team or renounce hockey, some Atlanta Thrashers supporters have chosen to stick with the franchise, which left for Winnipeg in 2011.By BEN SHPIGELThe Cavaliers took a 3-0 series lead against Toronto with a 105-103 overtime win on Saturday night in their second-round N.B.A. playoff series.By THE ASSOCIATED PRESSJakub Vrana scored the go-ahead goal as the Washington Capitals won, 6-3, and took a three-games-to-two lead in the second-round N.H.L. series.By THE ASSOCIATED PRESSManchester United’s former longtime manager had emergency surgery on Saturday for a brain hemorrhage, the team said in a statement.By THE ASSOCIATED PRESSNolan Arenado’s first-inning home run was all the Rockies needed on Saturday night at Citi Field.By WALLACE MATTHEWSThe Celtics took a 3-0 series lead against Philadelphia, which could not overcome two errant passes at key moments and a premature blast from a confetti cannon.By SCOTT CACCIOLAAlejandro Romero Gamarra had a goal and two assists to lead the Red Bulls on Saturday in the New York derby.Indians shortstop Francisco Lindor’s double error led to a pair of runs in a four-run fifth inning. It is the Yankees’ first 14-1 stretch since 1998.By DAVID WALDSTEINIn a steady rain, Justify, a chestnut colt who did not race as a 2-year-old, won the 144th Kentucky Derby. Good Magic was second, followed by Audible.By MELISSA HOPPERTHe has covered Jordan. He's covered Kobe. And LeBron vs. the Warriors. Go behind the N.B.A.'s curtain with the league's foremost expert in a new basketball newsletter.Get the big sports news, highlights and analysis from Times journalists, with distinctive takes on games and some behind-the-scenes surprises, delivered to your inbox every week.The Blue Jays reliever will appear in court on June 18 but M.L.B.’s domestic violence policy allows discipline regardless of whether there is a trial.By THE ASSOCIATED PRESSEvgeny Kuznetsov’s overtime goal ended Pittsburgh’s hopes of a third straight Stanley Cup title.By THE ASSOCIATED PRESSA surprise starter, McConnell scored a career-high 19 points as Philadelphia beat the Boston Celtics. Boston leads the series 3-1.By THE ASSOCIATED PRESSReid, a free agent safety, says the league has blackballed him for his protests during the national anthem.By VICTOR MATHERThe Boston Bruins left wing could face discipline after licking an opponent during a game for the second time in a month.By MATT STEVENSThe Golden State Warriors rolled to an easy win over the New Orleans Pelicans and the Houston Rockets beat the Utah Jazz.By THE ASSOCIATED PRESSVegas beat San Jose to advance to the Western Conference finals in their inaugural season, and the Lightning reached the East finals for the third time in four years.By THE ASSOCIATED PRESSBarcelona salvaged a draw and remained unbeaten in league play despite playing down a man after Sergi Roberto’s red card just before halftime.By THE ASSOCIATED PRESSA strange week for the Mets ended with yet another loss, Yoenis Cespedes injured, and Jacob deGrom on the disabled list.By JAMES WAGNERTorres’s first major league homer on Friday was overshadowed by a wild ending, but his second, on Sunday, proved even more memorable.By DAVID WALDSTEINA lawsuit claims that Steven and Jean Lopez, an Olympian and his star coach, sexually assaulted girls and women for years, and that Olympic officials knew.By JACEY FORTINRather than adopt another team or renounce hockey, some Atlanta Thrashers supporters have chosen to stick with the franchise, which left for Winnipeg in 2011.By BEN SHPIGELThe Cavaliers took a 3-0 series lead against Toronto with a 105-103 overtime win on Saturday night in their second-round N.B.A. playoff series.By THE ASSOCIATED PRESSJakub Vrana scored the go-ahead goal as the Washington Capitals won, 6-3, and took a three-games-to-two lead in the second-round N.H.L. series.By THE ASSOCIATED PRESSManchester United’s former longtime manager had emergency surgery on Saturday for a brain hemorrhage, the team said in a statement.By THE ASSOCIATED PRESSNolan Arenado’s first-inning home run was all the Rockies needed on Saturday night at Citi Field.By WALLACE MATTHEWSThe Celtics took a 3-0 series lead against Philadelphia, which could not overcome two errant passes at key moments and a premature blast from a confetti cannon.By SCOTT CACCIOLAAlejandro Romero Gamarra had a goal and two assists to lead the Red Bulls on Saturday in the New York derby.Indians shortstop Francisco Lindor’s double error led to a pair of runs in a four-run fifth inning. It is the Yankees’ first 14-1 stretch since 1998.By DAVID WALDSTEINIn a steady rain, Justify, a chestnut colt who did not race as a 2-year-old, won the 144th Kentucky Derby. Good Magic was second, followed by Audible.By MELISSA HOPPERTGo to Home Page »",Sports
