article,category
"AdvertisementSupported byROME — Italian voters' love affair with Silvio Berlusconi may be waning, judging by the slumping fortunes of his Forza Italia party in recent elections.But Italians are invited to explore the politician's relations with women in a new film by Oscar-winning director Paolo Sorrentino.The director on Wednesday described his film ""Loro"" (Them) as neither pro- or anti-Berlusconi — but instead tries to contemplate the ""feelings"" of the now 81-year-old ex-premier and media mogul toward his wife, who later sought a divorce, citing his keen interest in very young women.""It is not an ideological film or a film that takes a side,"" Sorrentino insisted to reporters after he screened the film in a Rome movie house. ""On the contrary, it's just the opposite.""Instead, so far, what ""hasn't been emphasized was the dimension of the feelings that were behind the political man,"" he said.The director described his latest film as also exploring people's fear of old age and death. ""Berlusconi's fear of old age and death is the fear we all have,"" he said.Berlusconi, who served three terms as premier, cannot currently hold office due to a tax fraud conviction, so he couldn't run for a fourth term in March 4 elections. But he still leads the center-right political party he created in the early 1990s.Italians were fiercely divided when Berlusconi used his media empire as a springboard into politics. Detractors feared he wanted to use his political power to protect his business interests. Admirers saw him as a fresh, straight-talking, can-do figure after decades of byzantine politics yielding short-lived governments.Sorrentino's ""The Great Beauty,"" which won the 2014 Oscar for Best Foreign Language Film, described the decadent political environment in Rome. His 2016 ""Youth -- La giovinezza"" described aging men's struggle with dwindling sexual energies.His latest film probes the collapse of Berlusconi's second marriage, to Veronica Lario, and her disappointment at the unraveling of their relationship.The backdrop for much of the film is a Sardinian villa, and the film features decadent parties there with lots of single young women present as Berlusconi's guests. But the movie doesn't cover Berlusconi's notorious ""bunga bunga"" sex-fueled parties at his Italian mainland homes — or the related legal woes that plagued him.Berlusconi, who has insisted that those evenings with his guests were ""elegant soirees"" with clean-cut entertainment, was acquitted on appeal of paying for sex with an underage woman.Italian actor Toni Servillo plays Berlusconi in the film, which is divided in two parts: ""Loro 1"" and ""Loro 2."" The first part opened in Italian cinemas last week, while ""Loro 2"" opens May 10.One of Italy's most acclaimed theater and screen actors, Servillo has played another iconic Italian politician, former seven-time premier Giulio Andreotti, in Sorrentino's movie, ""Il divo.""While Andreotti was a man who ""moved through the palaces of politics as an introvert,"" Servillo said Berlusconi is an ""extroverted diva who puts himself at the center of the political scene...waiting only for the moment to come back"" to the center of politics.Italian newspaper ""Il Fatto Quotidiano,"" known for its anti-Berlusconi stance, said Sorrentino with ""Loro"" effectively ""sanctions the recognition in the (not only) Italian collective imagination of the end of a personality, who already belongs to this country's past history.""___AdvertisementCollapseSEE MY OPTIONS",Movie
"AdvertisementCompiled entirely from real Russian dashboard camera videos, the movie is an experimental assemblage with no overarching plot or recurring characters. Instead, common cultural character emerges from dozens of disparate sketches. As if he were assembling a collection of Russian scary stories, the director Dmitrii Kalashnikov makes the bizarre beguiling.A preview of the film.Early on, a dashboard camera captures a green light as it burns across the horizon. The men who witness the light as they’re driving debate if they’ve seen a comet or a crashing plane, but on video the flash looks alien, like a probe from a foreign and hostile universe. Even when the danger turns out to be terrestrial in nature, “The Road Movie” always retains this same senseless strangeness. With every cut to a different camera, a surreal episode unfolds with a new menace. A couple drives through a forest fire so hot, the flames appear purple. When they aren’t avoiding crashes, drivers are threatened with guns, sledgehammers and hatchets. Without explanation, a man jumps on the hood of a stranger’s car, beating the glass first with his fists and then with his head.Perhaps strangest still is that throughout the bedlam, the drivers rarely betray their shock. They are under constant siege, but the only crack in their collective stoicism is the reliance on cameras to capture the chaos. The camera offers no protection; it only provides a witness. Fortunately for audiences, it’s more pleasurable to witness anarchy than it is to experience it.Not rated. In Russian with English subtitles. Running time: 1 hour 7 minutes.Go to Home Page »",Movie
"AdvertisementDuring his presidency, Ronald Reagan and his wife, Nancy, watched 363 movies at Camp David. Spread out over eight years, it’s a pardonably large total, especially for two former film actors, a couple who retained show business as a frame of reference long after they’d gone into its professional cousin, politics. All their viewing of the era’s biggest hits probably kept the Reagans more connected to the country than watching four hours a day of cable news.Mark Weinberg, a young press aide detailed to Camp David on the weekends, would join a group of staffers in Aspen Lodge each time the president opened the door just before 8 p.m. Everyone would watch the films, and the staffers would also watch their hosts. More than 30 years later, with the former first lady’s blessing, Weinberg began writing this amiable book about the experience. “Movie Nights With the Reagans” is fluffed with a loyalist’s nostalgia, but it does offer entertaining glimpses of the first couple, and it may lure even Reagan nonenthusiasts to indulge in some nostalgia of their own.“Movie Nights With the Reagans” probably would have worked better as a half-hour oral history, but here it is, not unwelcome, if only to remind us that the role of the president can be played by a charming gentleman instead of a scoundrel.Thomas Mallon’s most recent book is “Finale: A Novel of the Reagan Years.”We earn an affiliate commission with each book purchase, which helps support our journalism at The New York Times.Go to Home Page »",Movie
"AdvertisementSupported byROME — Italian voters' love affair with Silvio Berlusconi may be waning, judging by the slumping fortunes of his Forza Italia party in recent elections.But Italians are invited to explore the politician's relations with women in a new film by Oscar-winning director Paolo Sorrentino.The director on Wednesday described his film ""Loro"" (Them) as neither pro- or anti-Berlusconi — but instead tries to contemplate the ""feelings"" of the now 81-year-old ex-premier and media mogul toward his wife, who later sought a divorce, citing his keen interest in very young women.""It is not an ideological film or a film that takes a side,"" Sorrentino insisted to reporters after he screened the film in a Rome movie house. ""On the contrary, it's just the opposite.""Instead, so far, what ""hasn't been emphasized was the dimension of the feelings that were behind the political man,"" he said.The director described his latest film as also exploring people's fear of old age and death. ""Berlusconi's fear of old age and death is the fear we all have,"" he said.Berlusconi, who served three terms as premier, cannot currently hold office due to a tax fraud conviction, so he couldn't run for a fourth term in March 4 elections. But he still leads the center-right political party he created in the early 1990s.Italians were fiercely divided when Berlusconi used his media empire as a springboard into politics. Detractors feared he wanted to use his political power to protect his business interests. Admirers saw him as a fresh, straight-talking, can-do figure after decades of byzantine politics yielding short-lived governments.Sorrentino's ""The Great Beauty,"" which won the 2014 Oscar for Best Foreign Language Film, described the decadent political environment in Rome. His 2016 ""Youth -- La giovinezza"" described aging men's struggle with dwindling sexual energies.His latest film probes the collapse of Berlusconi's second marriage, to Veronica Lario, and her disappointment at the unraveling of their relationship.The backdrop for much of the film is a Sardinian villa, and the film features decadent parties there with lots of single young women present as Berlusconi's guests. But the movie doesn't cover Berlusconi's notorious ""bunga bunga"" sex-fueled parties at his Italian mainland homes — or the related legal woes that plagued him.Berlusconi, who has insisted that those evenings with his guests were ""elegant soirees"" with clean-cut entertainment, was acquitted on appeal of paying for sex with an underage woman.Italian actor Toni Servillo plays Berlusconi in the film, which is divided in two parts: ""Loro 1"" and ""Loro 2."" The first part opened in Italian cinemas last week, while ""Loro 2"" opens May 10.One of Italy's most acclaimed theater and screen actors, Servillo has played another iconic Italian politician, former seven-time premier Giulio Andreotti, in Sorrentino's movie, ""Il divo.""While Andreotti was a man who ""moved through the palaces of politics as an introvert,"" Servillo said Berlusconi is an ""extroverted diva who puts himself at the center of the political scene...waiting only for the moment to come back"" to the center of politics.Italian newspaper ""Il Fatto Quotidiano,"" known for its anti-Berlusconi stance, said Sorrentino with ""Loro"" effectively ""sanctions the recognition in the (not only) Italian collective imagination of the end of a personality, who already belongs to this country's past history.""___AdvertisementCollapseSEE MY OPTIONS",Movie
"AdvertisementSupported byOp-Ed ContributorsThe Times’s movie-mad columnists Frank Bruni and Ross Douthat met online with the Hollywood insider Lynda Obst, a movie producer and the writer of, most recently, “Sleepless in Hollywood: Tales From the New Abnormal in the Movie Business,” to banter and bicker about the Academy Awards and who should and who will win an Oscar.So the domestic smaller movie may find a home in some studios. And if they greenlight the right ones, it may be a small revival of these at the studios and at Oscar time.That said: Who should win best picture: “The Florida Project.” Who will win: “The Shape of Water.”For director, should win: Sean Baker for “The Florida Project.” Will win: Guillermo del Toro for “The Shape of Water.”For actor, should win: Denzel Washington in “Roman J. Israel, Esq.” Will win: Gary Oldman in “Darkest Hour.”For actress, should win: Brooklyn Prince in “The Florida Project.” Will win: Frances McDormand in “Three Billboards.”And for best actress, the award will go to Frances McDormand, who’s so brilliant across the board that I’m thrilled for her. It should go to Margot Robbie. Her last 15 minutes in “I, Tonya” — at the Olympics — are raw screen acting at its most effective.Ross?Frank Bruni and Ross Douthat are Op-Ed columnists for The Times. Lynda Obst is a movie producer, among others, of “Intersteller,” “Good Girls Revolt” and “Sleepless in Seattle” and the author, most recently, of “Sleepless in Hollywood: Tales From the New Abnormal in the Movie Business.”AdvertisementCollapseSEE MY OPTIONS",Movie
"AdvertisementSupported byOp-DocsAt any given moment across a beach in Fort Lauderdale, Fla., cruise ships speckle the horizon, their gargantuan bodies reduced to dots in the distance. I grew up near this beach, and most of the people I knew growing up had been on cruises. They would go away for a week or a weekend, drawn by the promise of escape, and return to land with bad sunburns, stories of small adventures and a few extra pounds. For these people, cruising was an occasional vacation. For Mario Salcedo, the subject of this Op-Doc, it’s his everyday life.I first learned about Mario through my grandparents, both of whom are avid cruisers. As several of their senior friends began to spend more time on cruises than on land, my grandparents became aware of an elite cabal of sorts within the cruising subculture: passengers scattered across different cruise lines who choose to live at sea permanently. One such passenger was Mario Salcedo, or “Super Mario” as the crew of the Enchantment of the Seas affectionately calls him. For the past two decades, Mario has been a full-time resident on Royal Caribbean Cruises, accumulating over 7,300 nights at sea.For nearly two decades, Mario had been living out of his suitcase, traveling extensively for his corporate job as the director of international finance at a multinational corporation. He spent more time in and out of hotel rooms scattered across Latin America than he did at his home in Miami. After working nonstop for nearly 21 years, Mario — burned out — decided it was time to pursue a lifelong goal: to travel around the world, without leaving home. In 1997, he quit his job, packed an even bigger suitcase and quietly disappeared from the lives of his friends and family to pursue a new life on the open water.This past August, a film crew of me and four others joined Mario for five days on the Enchantment of the Seas. As we soon discovered, Mario lives a far different life from the one portrayed by both himself — as an unofficial public ambassador for Royal Caribbean — and the press.The Mario we followed was not living the fantastical dream life of a “cruising king,” as I’d seen him described. The Mario we found lives a life full of paradoxes: while he proclaims his independence from others, he surrounds himself with throngs of anonymous tourists, shaking hands and selling his lifestyle. I was determined to crack through what I perceived to be a facade. But as I floated dreamily across a sea of professional smiles with Mario, I realized that his facade had taken on a reality of its own, that his ongoing voyages to nowhere — and everywhere — provided an overwhelming sense of freedom perhaps not found on land. It is in that freedom that Mario has finally found his home.AdvertisementCollapseSEE MY OPTIONS",Movie
"AdvertisementSupported by“The Last Movie Star” centers on Vic Edwards (Burt Reynolds), an alcoholic, washed-up actor who travels to a Nashville film festival to receive an honor without realizing that the event is a small-time, back-of-the-bar affair. (The organizer is played by Clark Duke, from “Hot Tub Time Machine,” while Ellar Coltrane of “Boyhood” plays a colleague who peppers Vic with trivia.)Emphasizing how pathetic and lonely Vic has become and how cluelessly the festival treats him — putting him up in seedy lodging, shoving a video camera in his face — the first part of the film is almost as mortifying to watch as it probably is for Vic to experience. We’re meant to regard the festivalgoers as harmless, overly avid fans, but the potshots are too broad and cheap.“The Last Movie Star” takes a turn from cringeworthy fish-out-of-water comedy into anodyne sentimentality when Vic and his incongruously dressed driver, Lil (Ariel Winter) — a goth aspiring artist whose sketches were contributed by the “Hellraiser” director Clive Barker — escape to Vic’s hometown Knoxville, where he makes peace with his past.The director Adam Rifkin wrote this showcase for Mr. Reynolds, who, like Vic, was a college football player. “The Last Movie Star” effectively allows the ever-assured actor to score a touchdown on an empty field. To make it look as if Vic is conversing with his younger self, Mr. Rifkin edits in footage of Mr. Reynolds from “Smokey and the Bandit” and “Deliverance.” It’s a decent idea, but the matching is poor and the clips appear arbitrary.Movie data powered by IMDb.comAdvertisementCollapseSEE MY OPTIONS",Movie
"AdvertisementDuring his presidency, Ronald Reagan and his wife, Nancy, watched 363 movies at Camp David. Spread out over eight years, it’s a pardonably large total, especially for two former film actors, a couple who retained show business as a frame of reference long after they’d gone into its professional cousin, politics. All their viewing of the era’s biggest hits probably kept the Reagans more connected to the country than watching four hours a day of cable news.Mark Weinberg, a young press aide detailed to Camp David on the weekends, would join a group of staffers in Aspen Lodge each time the president opened the door just before 8 p.m. Everyone would watch the films, and the staffers would also watch their hosts. More than 30 years later, with the former first lady’s blessing, Weinberg began writing this amiable book about the experience. “Movie Nights With the Reagans” is fluffed with a loyalist’s nostalgia, but it does offer entertaining glimpses of the first couple, and it may lure even Reagan nonenthusiasts to indulge in some nostalgia of their own.“Movie Nights With the Reagans” probably would have worked better as a half-hour oral history, but here it is, not unwelcome, if only to remind us that the role of the president can be played by a charming gentleman instead of a scoundrel.Thomas Mallon’s most recent book is “Finale: A Novel of the Reagan Years.”We earn an affiliate commission with each book purchase, which helps support our journalism at The New York Times.Go to Home Page »",Movie
"AdvertisementSupported byCompiled entirely from real Russian dashboard camera videos, the movie is an experimental assemblage with no overarching plot or recurring characters. Instead, common cultural character emerges from dozens of disparate sketches. As if he were assembling a collection of Russian scary stories, the director Dmitrii Kalashnikov makes the bizarre beguiling.Early on, a dashboard camera captures a green light as it burns across the horizon. The men who witness the light as they’re driving debate if they’ve seen a comet or a crashing plane, but on video the flash looks alien, like a probe from a foreign and hostile universe. Even when the danger turns out to be terrestrial in nature, “The Road Movie” always retains this same senseless strangeness. With every cut to a different camera, a surreal episode unfolds with a new menace. A couple drives through a forest fire so hot, the flames appear purple. When they aren’t avoiding crashes, drivers are threatened with guns, sledgehammers and hatchets. Without explanation, a man jumps on the hood of a stranger’s car, beating the glass first with his fists and then with his head.Perhaps strangest still is that throughout the bedlam, the drivers rarely betray their shock. They are under constant siege, but the only crack in their collective stoicism is the reliance on cameras to capture the chaos. The camera offers no protection; it only provides a witness. Fortunately for audiences, it’s more pleasurable to witness anarchy than it is to experience it.Movie data powered by IMDb.comNot rated. In Russian with English subtitles. Running time: 1 hour 7 minutes.AdvertisementCollapseSEE MY OPTIONS",Movie
"AdvertisementSupported by“The Last Movie Star” centers on Vic Edwards (Burt Reynolds), an alcoholic, washed-up actor who travels to a Nashville film festival to receive an honor without realizing that the event is a small-time, back-of-the-bar affair. (The organizer is played by Clark Duke, from “Hot Tub Time Machine,” while Ellar Coltrane of “Boyhood” plays a colleague who peppers Vic with trivia.)Emphasizing how pathetic and lonely Vic has become and how cluelessly the festival treats him — putting him up in seedy lodging, shoving a video camera in his face — the first part of the film is almost as mortifying to watch as it probably is for Vic to experience. We’re meant to regard the festivalgoers as harmless, overly avid fans, but the potshots are too broad and cheap.“The Last Movie Star” takes a turn from cringeworthy fish-out-of-water comedy into anodyne sentimentality when Vic and his incongruously dressed driver, Lil (Ariel Winter) — a goth aspiring artist whose sketches were contributed by the “Hellraiser” director Clive Barker — escape to Vic’s hometown Knoxville, where he makes peace with his past.The director Adam Rifkin wrote this showcase for Mr. Reynolds, who, like Vic, was a college football player. “The Last Movie Star” effectively allows the ever-assured actor to score a touchdown on an empty field. To make it look as if Vic is conversing with his younger self, Mr. Rifkin edits in footage of Mr. Reynolds from “Smokey and the Bandit” and “Deliverance.” It’s a decent idea, but the matching is poor and the clips appear arbitrary.Movie data powered by IMDb.comAdvertisementCollapseSEE MY OPTIONS",Movie
"AdvertisementSupported byNonfictionWhen you purchase an independently reviewed book through our site, we earn an affiliate commission.During his presidency, Ronald Reagan and his wife, Nancy, watched 363 movies at Camp David. Spread out over eight years, it’s a pardonably large total, especially for two former film actors, a couple who retained show business as a frame of reference long after they’d gone into its professional cousin, politics. All their viewing of the era’s biggest hits probably kept the Reagans more connected to the country than watching four hours a day of cable news.Mark Weinberg, a young press aide detailed to Camp David on the weekends, would join a group of staffers in Aspen Lodge each time the president opened the door just before 8 p.m. Everyone would watch the films, and the staffers would also watch their hosts. More than 30 years later, with the former first lady’s blessing, Weinberg began writing this amiable book about the experience. “Movie Nights With the Reagans” is fluffed with a loyalist’s nostalgia, but it does offer entertaining glimpses of the first couple, and it may lure even Reagan nonenthusiasts to indulge in some nostalgia of their own.“Movie Nights With the Reagans” probably would have worked better as a half-hour oral history, but here it is, not unwelcome, if only to remind us that the role of the president can be played by a charming gentleman instead of a scoundrel.Thomas Mallon’s most recent book is “Finale: A Novel of the Reagan Years.”AdvertisementCollapseSEE MY OPTIONS",Movie
"AdvertisementSupported byOp-Ed ContributorsThe Times’s movie-mad columnists Frank Bruni and Ross Douthat met online with the Hollywood insider Lynda Obst, a movie producer and the writer of, most recently, “Sleepless in Hollywood: Tales From the New Abnormal in the Movie Business,” to banter and bicker about the Academy Awards and who should and who will win an Oscar.So the domestic smaller movie may find a home in some studios. And if they greenlight the right ones, it may be a small revival of these at the studios and at Oscar time.That said: Who should win best picture: “The Florida Project.” Who will win: “The Shape of Water.”For director, should win: Sean Baker for “The Florida Project.” Will win: Guillermo del Toro for “The Shape of Water.”For actor, should win: Denzel Washington in “Roman J. Israel, Esq.” Will win: Gary Oldman in “Darkest Hour.”For actress, should win: Brooklyn Prince in “The Florida Project.” Will win: Frances McDormand in “Three Billboards.”And for best actress, the award will go to Frances McDormand, who’s so brilliant across the board that I’m thrilled for her. It should go to Margot Robbie. Her last 15 minutes in “I, Tonya” — at the Olympics — are raw screen acting at its most effective.Ross?Frank Bruni and Ross Douthat are Op-Ed columnists for The Times. Lynda Obst is a movie producer, among others, of “Intersteller,” “Good Girls Revolt” and “Sleepless in Seattle” and the author, most recently, of “Sleepless in Hollywood: Tales From the New Abnormal in the Movie Business.”AdvertisementCollapseSEE MY OPTIONS",Movie
