article,category
"AdvertisementSupported byCritic’s Notebook“Italy and its thousand cultures should be the Silicon Valley of cultural heritage,” it sings, one of many flourishes among the party’s proposals for art institutions, churches and heritage sites. Unlike the League’s American cousins — Mr. Salvini is an avowed fan of President Trump — these Italian populists like to present themselves as defenders of public cultural institutions, and their “Make Italy Great Again” vision highlights museums as much as migration policy. For Mr. Salvini’s party, the nationalist project goes right through the history of art.Unlike in Germany, where the Nazi regime policed strict aesthetic boundaries, Benito Mussolini did not impose a style on Italy’s artists after he came to power in 1922. Culture was to be in the service of a rejuvenated state, but it could take any number of forms — from the abstraction of the second-generation Futurists to the classical figuration of painters espousing a “return to order.” How were these artists shaped by the politics of their time? And how, in turn, did these artists, many of whom eagerly supported the Fascist regime, participate in the construction of a new Italian iconography?A color-starved still life of bottles on a table by Morandi, who made a quiet peace with Fascism, appears just as it did in a 1921 exhibition. It gives onto the hideous mock-classicist marble busts of Adolfo Wildt, who stole the show at the 1922 Venice Biennale and who would go on to sculpt Mussolini with the intensity of a Roman emperor. We then see Di Chirico’s pictures of stringy, bare-bottom gladiators as they were displayed in a Paris apartment, and a Roman museum populated by gross, classicized athletes and nymphs.Instead of the false clarity of the white cube, “Post Zang Tumb Tuuum” gives us a plural, kaleidoscopic view of the decades of Il Duce. You watch helplessly as the avant-garde hardens into agitprop, and see how even the most stolid of styles could be complicit in horror.It also erases the distinction between elite exhibitions and popular manifestations — above all when you reach Fondazione Prada’s huge Deposito, or warehouse, where Mr. Celant projects dozens of installation shots from the Exhibition of the Fascist Revolution, which opened in Rome in 1932, for the 10th anniversary of the regime. This epic show, drawing nearly four million visitors, rewrote Italy’s political history as a hybrid of sacred ceremony and love affair with the leader. Cantilevered walls plastered with Fascist slogans and clippings from Il Popolo d’Italia, Mussolini’s newspaper, gave way to stylized statues of the regime’s brawny “new men.” It concluded with a “Shrine to the Fallen,” dominated by a massive crucifix and blinding light.Picking up where Fondazione Prada’s show ends is “Dawn of a Nation,” at Palazzo Strozzi in Florence, a less ambitious exhibition that nevertheless offers an effective window onto Italian art amid postwar reconstruction. Unlike “Post Zang Tumb Tuuum,” it limits documentary material to an initial gallery, where a newsreel montage takes us from the foundation of the republic in 1946 to the “dolce vita” of the 1960s.The past was not forgotten in this postwar age: Mimmo Rotella, whose canvases comprised multiple posters sliced in the technique known as décollage, found an old Mussolini placard beneath an advertisement for a swords-and-sandals epic film. But the economic boom of the 1950s occasioned a new freedom in Italian art. A beautiful gallery here unites two dozen paintings and sculptures of all white: a slashed monochrome by Lucio Fontana, a foam rubber canvas by Giulio Turcato, and multiple achromatic works by Piero Manzoni, whose white bread rolls, rabbit-fur balls and canned excrement mocked both artistic genius and rampant consumerism.By the late 1960s, the Italian avant-garde had again become explicitly political, though this time it spoke the languages of the left. In Rome, the Pop artist Mario Schifano painted boys toting hammers and sickles, when he wasn’t recording prog-rock or in jail on drugs charges. And up in Turin, a loose collection of young artists started to embrace humble, everyday materials to challenge artistic hierarchies, and eventually became known as Arte Povera. (The man who coined that term? A young Germano Celant, the curator of “Post Zang Tumb Tuuum.”)“Dawn of a Nation” closes with one of the most emblematic works of Arte Povera: Giuseppe Penone’s “Rovesciare i Propri Occhi” (“Reversing One’s Eyes”), from 1970, in which the artist photographed himself wearing mirrored contact lenses, blinding himself and reflecting the world he usually saw back onto the viewer. The curators of “Dawn of a Nation” make the eyebrow-raising proposition that Mr. Penone’s photograph symbolizes “a nation gazing introspectively at itself and its history as it enters the period of critical tension” — that is to say, the violent years of the 1970s. That is a pretty desperate projection onto Mr. Penone’s intricate, sense-triggering art, and, when contrasted with the extreme precision of “Post Zang Tumb Tuuum,” it feels especially baseless.In any event, another work in “Dawn of a Nation” more explicitly encapsulates the tangled web of art and politics here. In Luciano Fabro’s “Italy” (1968), a steel cutout of the boot of Europe’s south hangs from the ceiling, but the wrong way up: a supporting wire stretches around Calabria, and Piedmont dangles down to the floor. It sways and swings like an air-dried prosciutto — or, indeed, like the body of Mussolini, hanging upside-down in a Milan square in 1945.Especially after March 4, as its citizens await to discover what sort of new government they will get, Fabro’s “Italy” feels familiar again, a portrait of a country both exquisite and hamstrung.AdvertisementCollapseSEE MY OPTIONS",Politics
"AdvertisementSupported byMELBOURNE, Australia — Australian politics these days feels like a story in People magazine. Political journalism, indeed Parliament itself, has been reduced to a forum for rumors about sex.It all began in February with the sensational news that Barnaby Joyce, then deputy prime minister, had been having an affair with an aide, who is now pregnant. Eventually Mr. Joyce resigned from his leadership post and retreated to the backbench. But the government’s response to the scandal ensured it would linger on.This might seem like a straightforward acknowledgment of the power imbalances within a government official’s office. But in truth it has meant that what might have been a footnote in Australian political history has instead set off the degradation of the country’s political culture.A consensual sexual relationship between a minister and a staff member has become a firing offense, like corruption or a conflict of interest. Every rumor of intra-office sex is now fair game for inquiry from the press and Parliament. Sex is now officially a matter of public interest.This could only have a deleterious effect on politics. And sure enough, that’s what has happened.But the truth is that the “morals lecture” came from Mr. Turnbull. Labor’s response throughout Mr. Joyce’s travails has been studiously amoral, focused on questions of whether his relationship had led him to abuse public funds, or whether the prime minister approved the transfer of Mr. Joyce’s former employee to other ministerial offices. Only when the prime minister made the affair itself a civil wrong by changing the office code of conduct for ministers did he make Ms. Cash’s comments a politically meaningful smear.The real problem here is not that Ms. Cash and Mr. Joyce exercised poor judgment. Politicians have been doing that for centuries. It’s that within this new political culture, Mr. Joyce could expect punishment for a consensual affair, and that Ms. Cash was saying something squarely relevant. Every political journalist now has a duty to explore sexual rumors, and politicians have a duty to investigate them.Mr. Turnbull’s attempt to deal with the power imbalances inherent between ministers and their staff was probably well intentioned. And concern about sex and power in ministers’ offices is utterly reasonable. But we can’t regulate office sexual conduct in a way that doesn’t transform sexual behavior into a matter of public interest. Any rules will be impossible to police except through the most corrosive and intrusive means.And that is before we even consider that to impose a ban like this is to dismiss the agency of the staff members. And it ignores the many perfectly sound relationships to come from such unbalanced circumstances.A policy that makes office sex a legitimate focus of journalistic and even political energy promises to do a major disservice in the long run. Australian politics might have become a little more sensationalistic through all this. And it has gotten a little smaller, too.Waleed Aly is a columnist and broadcaster and a politics lecturer at Monash University in Melbourne.AdvertisementCollapseSEE MY OPTIONS",Politics
"AdvertisementSupported byFrom the administration’s return to a hard-line immigration policy to the escalating possibility of an international trade war, it’s been another busy week in Washington. Here are five of the biggest stories driving American politics. (And some additional links if you want to read further.)As Trade Conflict Escalates, U.S. and China Enter a Battle of WillsHow the China-U.S. Trade Conflict Unfolded, Blow by BlowIn Sparing Consumers Tariff Burden, Trump Hits Manufacturing‘All It Takes Is One Mistake’: Worries Over Plan to Send National Guard to BorderTrump’s Immigration Tweets Followed by Policy Plans to Match‘You Hate America!’: How the ‘Caravan’ Story Exploded on the RightMr. Pruitt was already facing questions about his first-class travel at taxpayer expense over the past year.Growing Crisis Threatens Scott Pruitt, E.P.A. Chief, as Top Aide Eyes ExitFor Scott Pruitt, a Spotlight Shines on His Ethics, Not His E.P.A. RollbacksHow U.S. Fuel Economy Standards Compare With the Rest of the WorldQuietly, Trump Administration and California Seek Deal on Car EmissionsConsumer Bureau’s Chief Gives Big Raises, Even as He Criticizes SpendingHe Says He’s an Innocent Victim. Robert Mueller Says He’s a Spy.Yulia Skripal Isn’t Asking for Russia’s Help, U.K. SaysAdvertisementCollapseSEE MY OPTIONS",Politics
"AdvertisementSupported byBe they reports on the questions the special counsel plans to ask President Trump or more revelations about a payment made to Stormy Daniels, here are six of the biggest stories driving American politics this week.Additional ReadingThe Legal Issues Raised by the Stormy Daniels Payment, ExplainedGiuliani Contradicts Trump on Comey Firing, Saying Russia Inquiry Was a FactorMr. Cobb had argued that cooperating with the investigations would bring them to a swift conclusion, but the shake-up indicates that the president is bracing for a longer and more contentious battle on multiple legal fronts.Additional ReadingThe Loyalists and Washington Insiders Fighting Trump’s Legal BattlesGiuliani’s Bark May Come Back to Bite TrumpThe questions chiefly ask about the circumstances surrounding Mr. Trump’s decisions to fire his first national security adviser and the F.B.I. director, a 2016 meeting at Trump Tower between his campaign officials and Russians claiming to have dirt on Hillary Clinton and his relationship with Attorney General Jeff Sessions.Additional ReadingWhat Mueller Wants to Ask Trump About Obstruction, and What It MeansTrump Says Disclosure of Mueller Questions in Russia Probe Is ‘Disgraceful’Additional ReadingArmy Special Forces Secretly Help Saudis Combat Threat From Yemen RebelsFor U.S. and China, Lasers and Missiles Heighten Military TensionsAdditional ReadingThe U.S. Says It Has a Tariff Deal With Brazil. Brazil Disagrees.Tariff Impact Colors a Key House Race in Boeing CountryWhite House Considers Barring Chinese Telecom Sales as Tensions MountAdditional ReadingN.E.A. Chairwoman to Step Down in JuneRyan Reinstates House Chaplain After Priest Decided to Fight DismissalAdvertisementCollapseSEE MY OPTIONS",Politics
"AdvertisementSupported byWhether it was President Trump’s first state dinner, the visits of two prominent European leaders, the withdrawal of the president’s nominee to lead the Department of Veterans Affairs or a summit meeting between the leaders of North and South Korea, it was a big week in American politics and diplomacy. Here’s a look back at what you might have missed.Additional ReadingA History of Ronny Jackson in Fewer Than 70 WordsTrump’s Doctor Accused of Handing Out Ambien. D.E.A. Calls the Practice Illegal.News Analysis: For Many, Life in Trump’s Orbit Ends in a Crash LandingPresident Emmanuel Macron of France came to the United States with the intention of persuading Mr. Trump to not scrap the Iran nuclear deal next month, but it remained unclear whether he made progress toward that goal.Additional ReadingTrumps Throw Out Tradition for Their First State DinnerA National Security Aide’s Departing Wish: Cooking for the State DinnerPresident Trump Is Coming to Britain. Here’s What He Can Expect.Additional ReadingSupreme Court Arguments on Trump’s Travel Ban: Annotated ExcerptsNews Analysis: Courts Give Trump a Possible Path Through a Legal Minefield on ImmigrationRod Rosenstein Makes a Timely Supreme Court AppearanceAdditional Reading5 Takeaways From the House Report on Russian Election MeddlingMichael Cohen to Take Fifth Amendment in Stormy Daniels LawsuitWith No Nomination From Trump, Judges Choose U.S. Attorney for ManhattanManafort’s Lawsuit Taking Aim at Mueller Is Tossed Out of CourtAdditional ReadingJeff Sessions Is Serving, and Doing His Best to Ignore, TrumpThe Biggest Nafta Hurdle Now May Be CongressAdditional ReadingShrugging Off Trump Scandals, Evangelicals Look to Rescue G.O.P.Ms. Kardashian Goes to WashingtonDebbie Lesko Wins Arizona Special Election for Congress, Rallying G.O.P.Menendez Is ‘Severely Admonished’ by Senate Panel for Accepting GiftsAdditional ReadingFear and Hope in South Korea on Eve of Summit With Kim Jong-unParents Sue North Korea Over College Student’s Death After Time in PrisonAdvertisementCollapseSEE MY OPTIONS",Politics
"AdvertisementSupported byBe they reports on the questions the special counsel plans to ask President Trump or more revelations about a payment made to Stormy Daniels, here are six of the biggest stories driving American politics this week.Additional ReadingThe Legal Issues Raised by the Stormy Daniels Payment, ExplainedGiuliani Contradicts Trump on Comey Firing, Saying Russia Inquiry Was a FactorMr. Cobb had argued that cooperating with the investigations would bring them to a swift conclusion, but the shake-up indicates that the president is bracing for a longer and more contentious battle on multiple legal fronts.Additional ReadingThe Loyalists and Washington Insiders Fighting Trump’s Legal BattlesGiuliani’s Bark May Come Back to Bite TrumpThe questions chiefly ask about the circumstances surrounding Mr. Trump’s decisions to fire his first national security adviser and the F.B.I. director, a 2016 meeting at Trump Tower between his campaign officials and Russians claiming to have dirt on Hillary Clinton and his relationship with Attorney General Jeff Sessions.Additional ReadingWhat Mueller Wants to Ask Trump About Obstruction, and What It MeansTrump Says Disclosure of Mueller Questions in Russia Probe Is ‘Disgraceful’Additional ReadingArmy Special Forces Secretly Help Saudis Combat Threat From Yemen RebelsFor U.S. and China, Lasers and Missiles Heighten Military TensionsAdditional ReadingThe U.S. Says It Has a Tariff Deal With Brazil. Brazil Disagrees.Tariff Impact Colors a Key House Race in Boeing CountryWhite House Considers Barring Chinese Telecom Sales as Tensions MountAdditional ReadingN.E.A. Chairwoman to Step Down in JuneRyan Reinstates House Chaplain After Priest Decided to Fight DismissalAdvertisementCollapseSEE MY OPTIONS",Politics
"AdvertisementSupported byCritic’s Notebook“Italy and its thousand cultures should be the Silicon Valley of cultural heritage,” it sings, one of many flourishes among the party’s proposals for art institutions, churches and heritage sites. Unlike the League’s American cousins — Mr. Salvini is an avowed fan of President Trump — these Italian populists like to present themselves as defenders of public cultural institutions, and their “Make Italy Great Again” vision highlights museums as much as migration policy. For Mr. Salvini’s party, the nationalist project goes right through the history of art.Unlike in Germany, where the Nazi regime policed strict aesthetic boundaries, Benito Mussolini did not impose a style on Italy’s artists after he came to power in 1922. Culture was to be in the service of a rejuvenated state, but it could take any number of forms — from the abstraction of the second-generation Futurists to the classical figuration of painters espousing a “return to order.” How were these artists shaped by the politics of their time? And how, in turn, did these artists, many of whom eagerly supported the Fascist regime, participate in the construction of a new Italian iconography?A color-starved still life of bottles on a table by Morandi, who made a quiet peace with Fascism, appears just as it did in a 1921 exhibition. It gives onto the hideous mock-classicist marble busts of Adolfo Wildt, who stole the show at the 1922 Venice Biennale and who would go on to sculpt Mussolini with the intensity of a Roman emperor. We then see Di Chirico’s pictures of stringy, bare-bottom gladiators as they were displayed in a Paris apartment, and a Roman museum populated by gross, classicized athletes and nymphs.Instead of the false clarity of the white cube, “Post Zang Tumb Tuuum” gives us a plural, kaleidoscopic view of the decades of Il Duce. You watch helplessly as the avant-garde hardens into agitprop, and see how even the most stolid of styles could be complicit in horror.It also erases the distinction between elite exhibitions and popular manifestations — above all when you reach Fondazione Prada’s huge Deposito, or warehouse, where Mr. Celant projects dozens of installation shots from the Exhibition of the Fascist Revolution, which opened in Rome in 1932, for the 10th anniversary of the regime. This epic show, drawing nearly four million visitors, rewrote Italy’s political history as a hybrid of sacred ceremony and love affair with the leader. Cantilevered walls plastered with Fascist slogans and clippings from Il Popolo d’Italia, Mussolini’s newspaper, gave way to stylized statues of the regime’s brawny “new men.” It concluded with a “Shrine to the Fallen,” dominated by a massive crucifix and blinding light.Picking up where Fondazione Prada’s show ends is “Dawn of a Nation,” at Palazzo Strozzi in Florence, a less ambitious exhibition that nevertheless offers an effective window onto Italian art amid postwar reconstruction. Unlike “Post Zang Tumb Tuuum,” it limits documentary material to an initial gallery, where a newsreel montage takes us from the foundation of the republic in 1946 to the “dolce vita” of the 1960s.The past was not forgotten in this postwar age: Mimmo Rotella, whose canvases comprised multiple posters sliced in the technique known as décollage, found an old Mussolini placard beneath an advertisement for a swords-and-sandals epic film. But the economic boom of the 1950s occasioned a new freedom in Italian art. A beautiful gallery here unites two dozen paintings and sculptures of all white: a slashed monochrome by Lucio Fontana, a foam rubber canvas by Giulio Turcato, and multiple achromatic works by Piero Manzoni, whose white bread rolls, rabbit-fur balls and canned excrement mocked both artistic genius and rampant consumerism.By the late 1960s, the Italian avant-garde had again become explicitly political, though this time it spoke the languages of the left. In Rome, the Pop artist Mario Schifano painted boys toting hammers and sickles, when he wasn’t recording prog-rock or in jail on drugs charges. And up in Turin, a loose collection of young artists started to embrace humble, everyday materials to challenge artistic hierarchies, and eventually became known as Arte Povera. (The man who coined that term? A young Germano Celant, the curator of “Post Zang Tumb Tuuum.”)“Dawn of a Nation” closes with one of the most emblematic works of Arte Povera: Giuseppe Penone’s “Rovesciare i Propri Occhi” (“Reversing One’s Eyes”), from 1970, in which the artist photographed himself wearing mirrored contact lenses, blinding himself and reflecting the world he usually saw back onto the viewer. The curators of “Dawn of a Nation” make the eyebrow-raising proposition that Mr. Penone’s photograph symbolizes “a nation gazing introspectively at itself and its history as it enters the period of critical tension” — that is to say, the violent years of the 1970s. That is a pretty desperate projection onto Mr. Penone’s intricate, sense-triggering art, and, when contrasted with the extreme precision of “Post Zang Tumb Tuuum,” it feels especially baseless.In any event, another work in “Dawn of a Nation” more explicitly encapsulates the tangled web of art and politics here. In Luciano Fabro’s “Italy” (1968), a steel cutout of the boot of Europe’s south hangs from the ceiling, but the wrong way up: a supporting wire stretches around Calabria, and Piedmont dangles down to the floor. It sways and swings like an air-dried prosciutto — or, indeed, like the body of Mussolini, hanging upside-down in a Milan square in 1945.Especially after March 4, as its citizens await to discover what sort of new government they will get, Fabro’s “Italy” feels familiar again, a portrait of a country both exquisite and hamstrung.AdvertisementCollapseSEE MY OPTIONS",Politics
